{
  "version": 1,
  "source_language": "en",
  "languages": ["en", "vi"],
  "strings": [
    {
      "key": "a11y.call_ended",
      "en": "Call ended",
      "vi": "Cuộc gọi đã kết thúc",
      "comment": "VoiceOver announcement, without moving focus, when the call shown in the Mac call panel ends; the panel shows call.status_ended for 2 s, then closes (CALL-03 postconditions; design system Accessibility)",
      "platforms": ["macos"],
      "specs": ["CALL-03"]
    },
    {
      "key": "a11y.call_incoming_from",
      "en": "Incoming call from {caller}",
      "vi": "Cuộc gọi đến từ {caller}",
      "comment": "VoiceOver announcement when the Mac call panel or the iPhone/iPad in-app banner appears (CALL-01 special requirements, API 5 logic 5); {caller} = the contact name, else the number in national format, else call.no_caller_id or call.unknown_caller",
      "platforms": ["macos", "ios"],
      "args": [{"name": "caller", "type": "string"}],
      "specs": ["CALL-01"]
    },
    {
      "key": "a11y.missed_calls",
      "en": {"one": "{count} missed call", "other": "{count} missed calls"},
      "vi": {"other": "{count} cuộc gọi nhỡ"},
      "comment": "VoiceOver text of the missed-call badge on the Calls item of the Mac Messages window and on the Calls tab (iPhone, iPad): the pair's unseen missed calls (CALL-04 field 7)",
      "platforms": ["macos", "ios"],
      "args": [{"name": "count", "type": "int"}],
      "specs": ["CALL-04"]
    },
    {
      "key": "a11y.sms_bubble_received",
      "en": "{sender}, {time}",
      "vi": "{sender}, {time}",
      "comment": "VoiceOver label of a received message bubble (SMS-03 special requirements); {sender} = the conversation name, or the sender's number in national format in a group conversation; {time} formatted by the system; the message text is the accessibility value, read after the label",
      "platforms": ["macos", "ios"],
      "args": [{"name": "sender", "type": "string"}, {"name": "time", "type": "string"}],
      "specs": ["SMS-03"]
    },
    {
      "key": "a11y.sms_bubble_sent",
      "en": "You, {time}, {status}",
      "vi": "Bạn, {time}, {status}",
      "comment": "VoiceOver label of a sent message bubble (SMS-03 special requirements); {time} formatted by the system; {status} = the sms.status_* text; the message text is the accessibility value",
      "platforms": ["macos", "ios"],
      "args": [{"name": "time", "type": "string"}, {"name": "status", "type": "string"}],
      "specs": ["SMS-03"]
    },
    {
      "key": "a11y.unread_conversations",
      "en": {"one": "{count} unread conversation", "other": "{count} unread conversations"},
      "vi": {"other": "{count} hội thoại chưa đọc"},
      "comment": "VoiceOver text of the unread badge: after the connection status in the menu bar icon's label (Mac), on the Messages tab (iOS) — SMS-02 field 6",
      "platforms": ["macos", "ios"],
      "args": [{"name": "count", "type": "int"}],
      "specs": ["SMS-02", "SMS-05"]
    },
    {
      "key": "a11y.web_badge",
      "en": "HandLive, page from your phone available",
      "vi": "HandLive, có trang từ điện thoại",
      "comment": "VoiceOver label of the menu bar icon in its badge variant while a page from the phone is kept (WEB-02 field 1, special requirements)",
      "platforms": ["macos"],
      "specs": ["WEB-02"]
    },
    {
      "key": "a11y.web_ios_banner",
      "en": "Continue browsing: {title_or_host}, {host}",
      "vi": "Duyệt web tiếp: {title_or_host}, {host}",
      "comment": "VoiceOver label of the iPhone/iPad page banner, read as a button (WEB-05 special requirements); {title_or_host} = the page title, else its host; {host} = the page host",
      "platforms": ["ios"],
      "args": [{"name": "title_or_host", "type": "string"}, {"name": "host", "type": "string"}],
      "specs": ["WEB-05"]
    },
    {
      "key": "a11y.web_menu_item",
      "en": "Page from {device_name}: {title_or_host}",
      "vi": "Trang từ {device_name}: {title_or_host}",
      "comment": "VoiceOver label of the page menu item web.menu_item (WEB-02 special requirements); {device_name} = the phone; {title_or_host} = the page title, else its host",
      "platforms": ["macos"],
      "args": [{"name": "device_name", "type": "string"}, {"name": "title_or_host", "type": "string"}],
      "specs": ["WEB-02"]
    },
    {
      "key": "call.answer",
      "en": "Answer",
      "vi": "Trả lời",
      "comment": "Round Answer button of the Mac call panel (call-accept-fill, on the right, key Return; also its accessibility label), the HL_CALL_ANSWER action of the Mac incoming-call notification and the Answer item of the ringing call in the menu bar menu (also after Ignore); only when controls.answer = true (CALL-01 fields 6, 15, CALL-02 field 1); also the Answer button of the app-call panel when controls.answer = true (CALL-05 field 3)",
      "platforms": ["macos"],
      "specs": ["CALL-01", "CALL-02", "CALL-05"]
    },
    {
      "key": "call.answer_on_mac",
      "en": "Answer on Mac",
      "vi": "Nghe trên Mac",
      "comment": "Mac call panel: takes the place of call.answer, next to call.answer_on_phone, when call audio is in effect (Take Calls on Mac accepted on both sides); answers with the audio on the Mac (CALL-01 field 6, CALL-02 field 2)",
      "platforms": ["macos"],
      "specs": ["CALL-01", "CALL-02"]
    },
    {
      "key": "call.answer_on_phone",
      "en": "Answer on Phone",
      "vi": "Nghe trên điện thoại",
      "comment": "Mac call panel: takes the place of call.answer, next to call.answer_on_mac, when call audio is in effect; answers with the audio staying on the phone (CALL-01 field 6, CALL-02 field 2); in the app-call panel it replaces call.answer while call audio is in effect, without call.answer_on_mac, since an app call's audio stays on the phone (CALL-05 field 3)",
      "platforms": ["macos"],
      "specs": ["CALL-01", "CALL-02", "CALL-05"]
    },
    {
      "key": "call.answer_tooltip",
      "en": "Answer the call",
      "vi": "Trả lời cuộc gọi",
      "comment": "Tooltip of the round Answer button of the ringing Mac call panel (CALL-01 field 6); at most 75 characters",
      "platforms": ["macos"],
      "specs": ["CALL-01"]
    },
    {
      "key": "call.answering",
      "en": "Answering…",
      "vi": "Đang trả lời…",
      "comment": "In-progress label of the Mac call panel after Answer, until the ack or the next state arrives; the buttons stay locked (CALL-02 field 9)",
      "platforms": ["macos"],
      "specs": ["CALL-02"]
    },
    {
      "key": "call.app_incoming_title",
      "en": "{app_name} Call",
      "vi": "Cuộc gọi {app_name}",
      "comment": "Title of the Mac call panel, incoming and in-call, for a call from another app on the phone; {app_name} = app.label of call_event/app_call, the app's name as the phone reports it (never translated), e.g. “Telegram Call” (CALL-05 field 1)",
      "platforms": ["macos"],
      "args": [{"name": "app_name", "type": "string"}],
      "specs": ["CALL-05"]
    },
    {
      "key": "call.app_tap_to_answer_hint",
      "en": "Tap the notification on your phone to answer.",
      "vi": "Chạm vào thông báo trên điện thoại để nghe.",
      "comment": "Line of the Mac app-call panel after Answer succeeded with answer_mode = tap (no background-start exemption on the phone): it replaces the Answer button until the call state changes; Decline stays (CALL-05 field 6, E7)",
      "platforms": ["macos"],
      "specs": ["CALL-05"]
    },
    {
      "key": "call.app_tap_to_answer_title",
      "en": "Answer {app_name} Call",
      "vi": "Nghe cuộc gọi {app_name}",
      "comment": "Title of the Android tap-to-answer notification (channel hl_app_call) posted when the Mac answers a call from another app with answer_mode = tap; tapping it runs the app's answer intent; its text is the caller when known; {app_name} = the app's label (never translated) (CALL-05 field 12, API 5)",
      "platforms": ["android"],
      "args": [{"name": "app_name", "type": "string"}],
      "specs": ["CALL-05"]
    },
    {
      "key": "call.audio_on_mac",
      "en": "Audio: Mac",
      "vi": "Âm thanh: Mac",
      "comment": "In-call Mac call panel: the call audio plays on this Mac (audio_on = mac) (CALL-03 field 4)",
      "platforms": ["macos"],
      "specs": ["CALL-03"]
    },
    {
      "key": "call.audio_on_phone",
      "en": "Audio: Phone",
      "vi": "Âm thanh: Điện thoại",
      "comment": "In-call Mac call panel: the call audio plays on the phone (audio_on = phone) (CALL-03 field 4); always shown in the in-call app-call panel, whose audio stays on the phone (CALL-05 field 8)",
      "platforms": ["macos"],
      "specs": ["CALL-03", "CALL-05"]
    },
    {
      "key": "call.call_log_permission_hint",
      "en": "Allow HandLive to read the call log on the phone to see call history",
      "vi": "Cho phép HandLive đọc nhật ký cuộc gọi trên điện thoại để xem lịch sử cuộc gọi",
      "comment": "Guidance in the call list (Mac Messages window › Calls, iPhone/iPad Calls tab) when the phone lacks READ_CALL_LOG; missed calls are still notified from the call state (CALL-04 field 12, E2)",
      "platforms": ["macos", "ios"],
      "specs": ["CALL-04"]
    },
    {
      "key": "call.caller_id_permission_hint",
      "en": "Allow HandLive to read the call log on the phone to show caller numbers",
      "vi": "Cho phép HandLive đọc nhật ký cuộc gọi trên điện thoại để hiện số gọi đến",
      "comment": "Hint under call.unknown_caller in the Mac call panel and the iPhone/iPad banner when the phone's permissions_missing contains READ_CALL_LOG (CALL-01 field 12, E2)",
      "platforms": ["macos", "ios"],
      "specs": ["CALL-01"]
    },
    {
      "key": "call.connection_lost",
      "en": "Lost connection to the phone",
      "vi": "Mất kết nối với điện thoại",